id,overview_fra,overview_eng,overview_deu,overview_jpn
208666,"Nos héros s'apprêtent à poursuivre leur route vers Cimetronelle, mais Flora tarde à se préparer. Sacha commence à se fâcher et les deux enfants continuent leur querelle en chemin. Ils sont interrompus par un couple appelé Julie et Oscar, qui défie Flora et Sacha dans un combat par équipe...","After starting the long road to Fortree City, Ash and May are challenged to a Tag Battle, which involves two trainers against another two and each trainer using one of their Pokemon. The match is Corphish & Skitty vs. Nidoking & Nidoqueen. However the match doesn't go well, with Corphish and Skitty attacking each other rather than their opponents, leading Ash and May to fall out. They get a chance to settle their rivalry when they encounter Team Rocket, who are also arguing after losing to the same couple. Soon, the match is Ash & James vs. May & Jessie, with both teams determined to win...
","Auf ihrem Weg nach Baumhausen City treffen Ash und unsere Freunde auf ein Pärchen: Oscar und Andy. Ash und Maike sind schon den ganzen Tag am Streiten, und deshalb werden sie von den beiden Fremden für ein Liebespaar gehalten. Sie fordern Ash und Maike zu einem Treue-Kampf heraus. Da es in diesem Kampf auf partnerschaftliches Handeln ankommt, verlieren Maike und Ash den Kampf, da sie sich immer noch angiften. Auch die sich streitenden Jessie und James werden von Oscar und Andy zum Kampf herausgefordert und erleiden das gleiche Schicksal. James und Jessie, Maike und Ash streiten sich immer weiter. Als sie zufällig aufeinandertreffen, entscheiden sie sich zu einem Geschlechter-Treue-Kampf, Jessie und Maike gegen Ash und James. Doch Jessie hält sich nicht an die Regeln. Jessie und Maike werden disqualifiziert. In dem anschließenden Getümmel stiehlt Team Rocket Pikachu. Nur mit gemeinsamer Kraft und Teamwork können Ash und Maike Pikachu retten. Ash und Maike versöhnen sich und sind froh, so gute Freunde zu sein.",　つぎのもくてきち、ヒワマキシティにむかうサトシたちは、そのとちゅう、カテキンタウンで夜を明かすことにする。なかなかしゅっぱつのじゅんびができないハルカに、サトシはイライラ。口ゲンカをはじめてしまう。そこへ、ハデないしょうのふたり組、オスカーとアンドリューがあらわれ、２対２のタッグバトルをいどんできた。タッグバトルはふたりのコンビネーションがたいせつなのに、足をひっぱりあってしまうサトシとハルカ。このままふたりはやぶれてしまうのか…？
208667,Sacha et ses amis sont perdus dans une forêt lorsqu'ils sont attaqués par un Airmure qui kidnappe Flora...,"While walking through a dark forest, a Skarmory attacks the gang. When Skitty pops out it's Pokeball, May rushes to save it and ends up being carried off by the Steel Bird Pokemon, carrying her over a huge fence and dropping her off in a grassy area. While there, May encounters a Bulbasaur and becomes friends with it, but is soon attacked by other Grass Pokemon whom are extremely distrustful of humans. Meanwhile Ash, Brock and Max appeal to the Forest's protectors to allow them entry to rescue May, and when they are disallowed, the three decide to sneak in and save their friend...
","Unsere Freunde haben sich wieder einmal verlaufen. Doch diesmal lässt sie auch ihr Kompass und der Poke-Navigator im Stich. Plötzlich schnappt sich ein Panzaeron Maike und entführt sie in einen Landstrich, der für Menschen verboten ist. Dieses riesengroße Areal ist komplett eingezäunt, damit die Pflanzen-Pokemon, die dort leben, nie wieder von Menschen gestört oder geraubt werden. Eine kleine Gruppe Dorfbewohner, die am Rande dieses verbotenen Landes wohnt, wacht darüber, dass dieses Gebot auch eingehalten wird. Panzaeron setzt Maike in seinem Nest ab und verschwindet. Kurz darauf entdeckt Maike ein Bisasam, das sich in Lebensgefahr befindet, und rettet es. Doch dann wird sie von Pflanzen-Pokemon angegriffen. Zum Glück kann sie sich mit Enecos Glut-Attacke erfolgreich wehren. Da die Dorfbewohner sich nicht einig werden können, ob man wegen Maike das verbotene Land betreten darf oder nicht, macht sich Ash ohne Erlaubnis auf die Suche nach ihr. Er findet sie. Gemeinsam versuchen sie, den Pokemon zu entkommen. Plötzlich taucht ein riesiges Bisaflor auf, auf das die anderen Pokemon zu hören scheinen. Bisasam erklärt Bisaflor, dass Maike es gerettet hat. Daraufhin schlägt die Stimmung ins Positive um. Doch dann werden die Pokemon von Team Rocket angegriffen und gefangen genommen. Unsere Freunde können sie mit Hilfe der inzwischen hinzugeeilten Dorfbewohner und Bisaflor befreien. Team Rocket sucht wie üblich das Weite. Dankbar bringen die Pflanzen-Pokemon unsere Freunde und die Dorfbewohner wieder zum Tor zurück. Bisasam entscheidet sich, von nun an bei Maike zu bleiben. Maike kann ihr Glück kaum fassen!","　ヒワマキシティをめざすサトシたちは、森の中で道にまよい、いきなりとび出してきたエアームドにハルカをつれさられてしまう。いそいであとをおうサトシたちだったが、ぶあつい木のトビラと、ナゾの男たちがその前に立ちはだかった。男たちはこの森にすむ村人たち。かれらにとってそのトビラの先は禁断（きんだん）の地とよばれ、中に入ったものは「くさポケモン」のいかりにふれると、むかしからおそれられているらしい。ハルカをすぐにでもたすけ出したいサトシたちは、村人のすきをついてトビラをのりこえるが…。
　いっぽう、禁断の地にひとりとりのこされたハルカは、フシギダネ、クサイハナ、ウツドンといった「くさポケモン」にかこまれていて…。"
208668,"Les enfants arrivent dans une ville où Flora laisse son Bulbizarre profiter du paysage. Pendant ce temps, la Team Rocket se trouve au Centre Pokémon pour ""réparer"" le transporteur Pokémon...","As Ash and friends walk through a city, May decides to let her Bulbasaur out to see life outside of the forest. It tries to take an apple but May tells it not to saying that you have to buy things. Then, it decides to get in the back of a pickup truck full of flowers. Ash and Brock catch the truck and tell the driver to stop. May gets Bulbasaur back and they decide to find a Pokémon Center. When they arrive, Team Rocket is pretending to be mechanics fixing the transporter. After they leave, Ash decides to ask Professor Oak to send his Bulbasaur to meet May's but when the PokéBall arrives, it's empty. Every PokéBall that has come through the transporter since Team Rocket fixed it is empty. Then, the real mechanics arrive. Ash and friends chase Team Rocket and find them due to the trail of PokéBalls James left behind on accident.
","Unsere Freunde erreichen Nord-Blütenburg. Maikes und Max’ Vater ist dort so berühmt, dass die Bewohner seine beiden Kinder wie Stars empfangen. Als sie dann noch erfahren, dass Maike schon zwei Bänder als Koordinator gewonnen hat, bordet die Begeisterung über! Team Rocket macht sich die Stimmung der Stadt zunutze und schlüpft in die Rollen von Norman, seiner Frau und deren Kindern. Sie verkaufen Autogramme und Souvenirs und machen damit säckeweise Geld. Als Ash den Bewohnern erzählt, dass er Norman zu einem Arena-Kampf herausfordern will, ist die Empörung gewaltig. So gut wie alle Trainer fordern ihn zu einem Kampf heraus. Ash gewinnt zwar diese Kämpfe, aber er ist völlig ausgepowert. Die Bewohner wollen, dass Maike gegen Ash antritt. Maike lässt sich darauf ein und gewinnt den Kampf. Team Rocket fliegt mit seiner Maskierung auf und gibt sich zu erkennen. Aber Ash kann Team Rocket mit Hilfe von Pikachu in die Flucht schlagen. Doch die Bewohner sind nur von Pikachus Leistung beeindruckt. Ash kann keinen Zentimeter an Boden gewinnen. Nachdem Team Rocket abgerauscht ist, machen sich unsere Freunde auf den Weg nach Blütenburg zu Maikes und Max Vater.",　シワブキタウンに立ちよるサトシたち。ポケモンセンターのテレビ電話で、オーキド博士とれんらくをとったサトシは、サトシのフシギダネを転送（てんそう）させて、ハルカのフシギダネとあそばせてあげようと思いつく。そして、いよいよ転送をはじめるが、なにも出てこない。どうやら、きかいをしゅうりする人にへんそうしただれかが、転送マシンをかいぞうして、転送したモンスターボールをよこどりしていたのだモンスターボールをとりもどすため、サトシたちはいそいでそのあとをおいかけるが…。
208669,"Sur la route de Cimetronelle, Sacha et ses amis se sont arrêtés pour camper au bord d'un lac. Sacha trébuche et fait tomber son étui à Badges dans le lac, où il est avalé par un Barbicha géant...","While resting by a lake, Ash decides to polish his Badge Case and remembers all the Gym Battles he's so far had in Hoenn, when suddenly a larger than normal Whiscash, a Water-Ground type Pokemon jumps out and eats the case. Determined to get his hard-earned badges back, he dives in but nearly drowns when he is saved by a Fishing Master who has spent years trying to catch the giant Whiscash. Determined to retrieve the badges, Ash and the others start fishing. Meanwhile Team Rocket are also trying to get a hold of the same Whiscash (figuring if they capture it, they will get both a new Pokemon and a bunch of badges) but things go crazy when a Feebas bites onto Jesse's hair...
","Ashs Orden werden von einem Welsar, einem Pokemon, das funkelnde Dinge liebt, gestohlen. Ash jagt es unter Wasser und verliert dort das Bewusstsein. Sullivan ‚angelt‘ ihn in letzter Sekunde aus dem See. Sullivan nennt sich selbst einen angelnden Gott. Seit 50 Jahren versucht er Nero, wie er dieses Welsar nennt, zu fangen. Mit der Hilfe unserer Freunde will er Welsar fangen und Ash seine Orden zurückgeben. Mit einigen Lektionen weist er unsere Helden in die Kunst des Angelns ein. Max zeigt beim Angeln ein geschicktes Händchen. Zufällig fängt Ash Welsar. Doch Team Rocket schaltet sich ein und schnappt sich das gigantisch große Pokemon. Unsere Freunde können sie, dank Welsars Unterstützung, in die Flucht schlagen. Welsar gibt Ash seine Orden zurück. Sullivan versucht mit seinem Waaty und seinem Meister-Ball, Welsar zu fangen. Doch Welsar schluckt den Meister-Ball und bleibt auf freiem Fuß. Sullivan wird also weiter diesem Welsar auf der Spur bleiben müssen, und unsere Freunde setzen ihre Reise fort.","　みずうみのほとりでひと休みすることにしたサトシたち。これまでたたかってきたバトルで手に入れたバッジをながめていたサトシだったが、うっかりバッジをケースごと水の中におとしてしまう。すると、みずうみから巨大（きょだい）ナマズンがあらわれ、バッジケースをパクリと口にくわえていってしまった。あわててあとをおい、みずうみにとびこむサトシだったが、おぼれてしまう。
　サトシをたすけたのは、ぐうぜんそこにいた釣り師（つりし）だった。この釣り師、なにやら巨大ナマズンとかかわりがあるようだったが…。"
208670,"Sur leur chemin, Sacha et ses amis font la connaissance de Maria et de ses sept Granivol. La jeune fille raconte à nos amis qu'elle est météorologiste et qu'elle utilise ses Granivol pour mesurer la force du vent. Seulement, parmi les Granivol se trouve un Mystherbe qui rêve de s'envoler comme ses compagnons.","After becoming separated from his friends in a dense mist, Ash comes across a Baltoy spinning dangerously close to the edge of a cliff. After saving the Pokemon, Ash meets it's trainer Calista who is looking for a fabled treasure that lies nearby. Always eager for an adventure, Ash and Pikachu agree to help, but the quest is interrupted when Team Rocket try to snag Pikachu (as usual). However, a mysterious woman appears and after sending Team Rocket blasting off with her Xatu, explains that she too has a Baltoy which has become trapped in a cavern, and if she helps to release it, then she will show Calista how to find the treasure...
","Unsere Freunde sind auf dem Berg Kirikiri und verlieren sich in den dicken Nebelschwaden. Ash ist plötzlich mit Pikachu allein. Er trifft auf eine geheimnisvolle Frau, die ein noch geheimnisvolleres Lied singt. Doch dann ist sie verschwunden. Kurz darauf lernt Ash Calista und ihr Puppance kennen. Calista sucht hier in den Bergen nach Zeugnissen der uralten Zivilisation der Puppance. Sie hat Informationen darüber in einem Buch gefunden. Sie ist heimlich hier, da ihre Eltern dagegen sind, dass sie sich so brennend für Archäologie interessiert. Heute hat sie einen Anruf von einer Frau bekommen, die sie bat, zusammen mit ihrem Puppance in die Berge zu kommen, um ihr zu helfen. Ash vermutet, dass es sich dabei um jene Frau handelt, die er gesehen hat, und führt Calista zu ihr. Inzwischen wurde diese Frau von Team Rocket überfallen, da das Team gehört hat, dass sich in den alten Ruinen der kostbarste Schatz des Universums befindet. Doch die Frau kann sie in die Flucht schlagen. Dann führt sie Ash und Calista zu den alten Ruinen. Dort erfährt Calista, dass die geheimnisvolle Frau sie selbst aus der Zukunft ist. Sie bittet Calista, unter allen Umständen ihren Traum zu verfolgen, da wir nur ein Leben haben. Und unser kostbarstes Gut , unser kostbarster Schatz ist ‚Zeit‘, von der sie nicht mehr allzu viel hat. Und es gibt noch zahlreiche Geheimnisse der Puppance Zivilisation zu entdecken. Mit Hilfe einer der größten Erfindungen dieser Zivilisation, einer Zeitmaschine, ist sie zu Calista gelangt. Doch sie muss wieder fort. Calista weiß jetzt, dass sie Archäologin wird, und Ash ist entschlossener denn je, ein Pokémon-Meister zu werden!",　ホウエンリーグに出るために旅（たび）をつづけるサトシたちは、キリキリ山にのぼることに。しかし、ふかい霧（きり）につつまれた山の中で、サトシとピカチュウはみんなとはぐれてしまう。まいごになったサトシたちは、とつぜん霧の中からあらわれたナゾのおばあさんと出会うが、彼女はおかしなわらべ歌を歌いながら、ふたたび霧の中にきえてしまう。なおもさまよいつづけるサトシは、ガケからおちそうになったヤジロンをたすけたことをきっかけに、クルヨと名のる少女と出会う。まぼろしの古代遺跡（こだいいせき）をしらべていたクルヨは、先ほどのわらべ歌を手がかりにしていたが…。
208671,"Flora se rend au Concours Pokémon de Rubello, où au moins un Ruban est nécessaire pour participer...","The gang enter Rubello Town, and May is delighted to see that a Pokemon Contest is due to begin the next day. Deciding to enter, May meets up with Drew, who is also entering with his new Masquerain, but Drew is soon surrounded by a lot of female admirers (sounds a bit like Gary) which makes May feel a little jealous. However, the jealously is forgotten when she also gets a group of fans approach her. Savannah, the head of the group, explains that they saw May in the Verdanturf Contest and that she will be entering this contest with her Lairon and Flareon, making May realise she's got a new rival. Deciding to enter Bulbasaur in the contest, May and Savannah have a practice battle when Team Rocket appear. It seems that Jessie has attempted to enter Dustox in the contest, but she can't as she doesn't meet the entry requirement of a Ribbon, so she's gonna steal one instead...
","Unsere Freunde kommen nach Rubello City und freuen sich, dass dort am nächsten Tag ein Wettbewerb beginnt, an dem Maike auch unbedingt teilnehmen möchte. Sie trifft auf Drew mit seinem neuen Pokémon Maskeregen, der von einer Fan-Gruppe, genannt MFP, stürmisch gefeiert wird, was Maike neidisch werden lässt. Alles ist vergessen, als die MFP dann Maike bestürmen, weil sie Normans Tochter ist. Savannah, die Leiterin der MFP, hat sich auch zum Wettbewerb mit ihrem Flamara und Stollrack angemeldet und wird vielleicht zur Rivalin für Maike. Indes will auch Jessie von Team Rocket teilnehmen, wird aber abgewiesen, weil sie kein Siegerband vorweisen kann. Kurz entschlossen stiehlt Team Rocket die Bänder von Savannah und Maike. Die Teilnahme am Wettbewerb ist damit in Frage gestellt. Doch Jessie lässt sich überreden sie ihnen zurückzugeben, denn sie hat schon wieder eine neue Idee…","　たびのとちゅう、サトシたちはルイボスタウンにたちよった。この街でポケモンコンテストがあると知ったハルカは大よろこび。ライバルのシュウにも出会い、火花をちらしていると、ママさんたちがものすごいおうえんをはじめ、ふたりはびっくりする。しかも、「ポケモン大すきママさんズ」と名のるそのメンバーのひとり、ツキコも大会にしゅつじょうするという。ツキコとなかよくなったハルカは、きんちょうしている彼女のれんしゅうのあいてになってあげる。
　いっぽう、この大会がコンテストリボンをもっている人だけがしゅつじょうできると知ったロケット団は、ハルカたちのリボンをねらおうとするが…。"
208672,"C'est le début du Concours Pokémon de Rubello. Savannah est toujours nerveuse, mais Flora semble particulièrement confiante. Toutes deux passent le premier tour sans encombre...","It's Contest Day in Rubello Town and May is as determined as ever to win, and with her victories in Fallabor and Verdanturf Town she is extremely confident. After May uses Beautifly in the Appeal rounds (participants are allowed to use different Pokemon for the Appeal and the Battle Rounds), she easily passes the qualifiers with Drew and Savannah. However, as she prepares for the Battle Rounds against Lairon, Ash warns her that Bulbasaur might not be ready, since it's never actually been in a battle before but May is confident in it's abilities, but is she being a bit overconfident, especially since the winner of the match will face Drew and his Masquerain in the final...
","Maike tritt zu einem Wettbewerb an und will unbedingt ihr drittes Band gewinnen. Savannah nimmt auch an diesem Wettbewerb teil. Sie ist sehr nervös. Doch Maike fühlt sich aufgrund ihrer zwei Bänder, die sie gewonnen hat, schon jetzt als Champion und erteilt ihr äußerst arrogant weise Ratschläge. Jessie versucht mit einem gefälschten und viel zu großem Band, ein Band ist Voraussetzung für diesen Wettbewerb, an der Veranstaltung teilzunehmen.. Sie wird rausgeschmissen. Als sie das Band dann aber an eine Frau als Schmuckband für ihr Pokemon verkaufen kann, beschließt Team Rocket in die ‚Bänder-Produktion‘ einzusteigen. Sie produzieren wie die Weltmeister, verkaufen aber nicht ein einziges Band. Sowohl Savannah als auch Maike und ihr großer Widersacher Drew schaffen es in die 2. Runde. Maike tritt in der 2. Runde gegen Savannah an. Da Maike sich vorher in der Kabine heftig mit Ash gestritten hat, ist Bisasam völlig neben der Spur. Und so verlieren sie den Kampf. Maike wird sogar noch wegen ihres Verhaltens ihrem Pokémon gegenüber von den Schiedsrichtern gemaßregelt. Drew und Savannah bestreiten den Endkampf, den Drew gewinnt. Maike kapiert, dass sie sich dumm verhalten hat, und schwört sich, diesen Fehler nie mehr zu machen.",　いよいよルイボスタウンでのポケモンコンテストがはじまった。アゲハントのちょうしがいいため、よゆうたっぷりのハルカ。いっしょにれんしゅうしたツキコも、しあいのカンをとりもどし、なかなかいいできばえ。ライバルのシュウも、ロゼリアの花ふぶきで会場のお客をウットリさせた。 　そろって一次審査（いちじしんさ）を勝ちハルカたち。だが、ハルカの二次審査のたいせんあいては、なんとツキコにきまってしまった。フシギダネのデビュー戦をさいこうのものにしたいと、気合（きあい）じゅうぶんのハルカだったが…。
208673,"Tandis que nos héros prennent un petit-déjeuner de bon matin, Skitty se retrouve façe à un Spoink à qui il manque quelque chose... sa perle. Comment Sacha et ses amis vont-il faire pour la retrouver ?","Continuing the trek to Fortree City, Ash and the gang come across a Spoink, a Psychic-Type Pokemon. However, this Spoink is upset after losing the Pearl it keeps on top of it's head. After Spoink tries putting a couple of round Pokemon on it's head (including an Igglybuff and a Voltorb), the Pearl is found, however Team Rocket, working with renewed vigor after Giovanni threatened to replace them, steal the Pearl. After coming across a fair, James is approached by the same Magikarp Salesman who has made his life a misery in the past and offers to trade Feebas for the Pearl. After discovering Feebas evolves into Milotic, the most beautiful of Pokemon, Jessie, James and Meowth eagerly agree. However, when they let their new Feebas have a swim in a nearby river, they discovered the Feebas is just a Magikarp painted with a Feebas colors, meaning they have been swindled yet again (when will they learn?)! After Ash and the others hear what's happened, they realise that, in order to get Spoink's Pearl back, they need to find the Magikarp Salesman before Team Rocket do!
","Team Rocket kommt langsam unter Druck. Ihr Boss Giovanni will Resultate sehen… . Unsere Freunde treffen auf ein Spoink, das eine Perle von seinem Kopf verloren hat. Diese Perle braucht es, um seine Psycho-Power zu vergrößern. Wenn es keine Perle hat, wird es außerdem zunehmend müder. Unsere Helden beschließen, Spoink bei der Suche zu helfen. In seiner Verzweiflung setzt sich Spoink alles auf den Kopf, was auch nur entfernt nach Perle aussieht. Schließlich finden sie die Perle. Doch während eines Kampfes gegen Team Rocket, landet sie in deren Besitz. Und Team Rocket tauscht die Perle an einem Verkaufsstand gegen ein gefaktes Barschwa ein, das in Wirklichkeit ein Karpador ist… Ash und seine Freunde finden den betrügerischen Verkäufer. Der hat auch die Perle noch. Doch erst nach einem Kampf gegen Team Rocket können unsere Helden die Perle Spoink zurückgeben. Glücklich setzen sie ihre Reise fort.","　つぎのジム戦があるヒマワキシティをめざすサトシたちは、そのとちゅう、元気のないようすのバネブーに出会う。頭の真珠（しんじゅ）をどこかでなくしてしまいこまっていると知ったサトシたちは、いっしょにさがしてあげることに。ところが、まるいものを見つけるとなんでも頭にのせてしまうバネブーに、サトシたちはふりまわされてしまう。
　やっとの思いでミズゴロウに見つけてもらった真珠を自分の頭にのせ、よろこぶバネブー。ホッとするサトシたちだったが、そこへロケット団があらわれ…。"
