id,overview_fra,overview_eng,overview_deu,overview_jpn
208647,"En route pour Vermilava, la petite troupe menée par Sacha fait la connaissance de Julie, une coordinatrice Pokémon qui élève des Chamallots...","After escaping a group of angry Slugma, Ash and Co. find themselves in a meadow populated by Numel. After befriending the meadow owner, the gang stay at her cabin, and May learns that her rebellious Skitty knows Assist, which allows it to borrow an attack from another Pokemon in May's team. However Skitty's new ability is put to the test when Team Rocket arrive to steal the Numel.
","Ash und seine Freunde werden in einer Höhle von Schneckmag angegriffen und können ihr nur mit knapper Not entkommen. Kurz darauf machen sie auf einer Ranch Halt, wo sie Julie und ihre Camaub kennen lernen. Bei einem kleinen Pokémonkampf stellt sich heraus, dass Maike bei ihrem Eneco eine Zuschussattacke einsetzen kann, mit der Eneco in der Lage ist, sämtliche Attacken von Maikes anderen Pokémon loszulassen. Kurz darauf werden unsere Freunde von Team Rocket angegriffen, die mit einem überdimensionalen Camaubmobil versuchen, Julie ihre Camaub abzunehmen. Die Lage spitzt sich bedrohlich zu, wobei Maike und Eneco von Team Rocket entführt werden. Zum Glück hat sie die rettende Idee: Sie setzt bei Eneco Zuschussattacken ein, mit denen sie sich aus den Händen des Gaunertrios befreien kann. Team Rocket zieht wieder mal den Kürzeren und macht einen Abflug in Richtung Umlaufbahn…","　えんとつ山へむかうために「ほのおのぬけ道」とよばれるどうくつをすすんでいたサトシたちは、マグマックのむれにおわれて、なだらかな丘がひろがる牧場にたどりついた。そこでサトシたちは、ドンメルをかうヨウコと出会い、家にとめてもらえることになる。すると、ハルカがエネコに本当のバトルをけいけんさせたいと言い出し、ヨウコとバトルをすることに。ハルカはエネコの新しいワザ「ねこのて」をつかうが、バトルになれているヨウコのオオタチをあいてに、くるしんでしまう。
　その夜、何者かがドンメルをねらって牧場にしのびこんできて…。"
208648,"Sacha, Flora, Max et Pierre poursuivent leurs aventures dans le monde de Hoenn. Ils découvrent alors un univers étonnant et plus menaçant que jamais.","Needing to pass Mt. Chimney to reach Lavaridge Town, Ash and friends begin their journey over the mountain in a cable car. However Team Magma arrive in order to steal a meterorite that recently landed there from the local Professor. When Team Aqua also arrive to get the meteorite and disable the in-transit cable car, Ash manages to escape and decides to try and save the meterorite from the duelling rivals.
","Ash und seine Freunde sind in der Seilbahn auf dem Weg zum Schlotberg und haben drei seltsame Fremdenführer an Bord, die sich später als Jessie, James und Mauzi entpuppen. Oben auf dem Plateau des Schlotberges befindet sich Professor Kosmo, der dort einen Meteoriten aus dem All gefunden hat. Plötzlich wird die Seilbahn auf dem halben Weg von Team Magma angehalten, die sich den Meteoriten unter den Nagel reißen wollen, um ihn als Zünder in einer Laserkanone zu benutzen, mit der sie den Vulkan auf dem Schlotberg aktivieren wollen. In der Zwischenzeit ist auch Team Aqua aufgetaucht, das ebenfalls großes Interesse an dem Stein hat. Die Situation in der Seilbahnkabine spitzt sich bedrohlich zu und Ash beschließt, gemeinsam mit Pikachu Hilfe zu holen. Unterwegs treffen die beiden auf Professor Kosmo, dem Team Magma den Meteoriten bereits abgeknöpft hat. Mit vereinten Kräften gelingt es ihnen, das Vorhaben von Team Magma zu vereiteln und die anderen aus der Seilbahnkabine zu befreien. Nun können sie sich getrost weiter auf den Weg nach Bad Lavastadt zu Ashs nächstem Arenakampf machen…","　つぎのジムがあるフエンタウンをめざして旅をつづけるサトシたちは、えんとつ山のふもとにたどりついた。そこからロープウェイで山のてっぺんにむかうサトシたちだったが、そのとちゅうでとつぜんゴンドラがとまってしまう。非常用（ひじょうよう）の電話でたすけをよんでもまったくへんじがないため、サトシはひとりでゴンドラからおりて、たすけをもとめに行く。
　そのころ、噴火口（ふんかこう）の近くでは、学者のソライシ博士が見つけたいん石をめぐり、マグマ団とアクア団のたたかいがはじまろうとしていたが…。"
208649,"Sacha et ses amis arrivent à Vermilava, où Sacha espère décrocher un quatrième badge de la région Hoenn...","Ash and Co. reach Lavaridge Town where they meet Flannery, the  Gym Leader. Having just inherited the Gym from her Grandfather days earlier and determined to prove her abilities, she is just as eager as Ash to battle, but the Gym's battlefield is full of holes and therefore cannot be used. Deciding to help, the gang are soon hard at work filling the holes, however Team Rocket are standing by ready to snatch one of Flannery's Pokemon, a Torkoal that they can give to Giovanni!
","Ash und seine Freunde sind endlich in Bad Lavastadt angekommen und treffen dort auf die neue Arenaleiterin Flavia. Großvater Mr. Moore hat sich vor drei Tagen verabschiedet, um eine größere Reise zu unternehmen und überlässt Flavia ihrem Schicksal, die wenig Ahnung von ihren neuen Aufgaben hat. Bei ihrem letzten Match ist die Arena in einen riesigen Trümmerhaufen verwandelt worden und Ash und seine Truppe wollen ihr beim Aufräumen helfen. Opa Moore beobachtet die ganze Sache aus der Ferne und kehrt als Schiedsrichter verkleidet wieder zurück, um seiner Enkelin beizustehen, aber Team Rocket ist natürlich auch zur Stelle und gibt sich als Arena-Instandsetzungs-Service aus, dabei will sich das Gaunertrio natürlich ein Pokémon unter den Nagel reißen. Es wird langsam eng für unsere Freunde, aber es gelingt ihnen, im letzten Moment Team Rocket die Suppe gehörig zu versalzen und es wieder mal auf einen Flug in die Umlaufbahn zu schicken…","　ようやくフエンタウンにとうちゃくしたサトシたちは、さっそくフエンジムをおとずれる。しかし、ジムリーダーのアスナといっしょにバトルフィールドにむかうと、フィールドは穴（あな）だらけでボロボロ。しかも審判（しんぱん）もいないというひどいじょうたいだった。アスナに話を聞いてみると、３日前まではアスナのおじいさんのムラ爺（じい）がフエンジムをしきっていたのだが、とつぜんアスナにジムをまかせ、旅に出てしまったのだという。のこされたアスナは、ジムリーダーとして自分のポケモンを強くすることだけしかかんがえていなかったのだ。
　そのころ、旅に出たはずのムラ爺は、アスナのことがしんぱいでフエンタウンにもどってきていた。ほんの数日で旅からもどってきてしまい、みんなに合わす顔がないムラ爺は、へんそうしてこっそりアスナを見まもることになるが…。"
208650,"Sacha gagne son quatrième badge d'Hoenn, le badge Chaleur, contre Adriane (Type Feu).","Ash and Flannery begin their long-awaited Gym battle, with Ash beginning with Corphish and Flannery starting with her newly-evolved Magcargo. With Flannery desperate to prove herself as a worthy Gym Leader, Ash has to hope that his Pokemon are strong enough to defeat her.
","Endlich ist es soweit: Ash tritt gegen Flavia an, um den Hitze-Orden von Bad Lavastadt zu ergattern. Team Rocket beobachtet das Geschehen mit großem Interesse und will einen Tunnel unter der Arena graben, um sich dann Pikachu und Flavias Magcargo unter den Nagel zu reißen. Leider zapfen sie bei den Bohrungsarbeiten eine Wasserleitung an und werden ziemlich bald außer Gefecht gesetzt. In der Zwischenzeit entbrennt ein heißes Match zwischen Ash und Flavia, die als Überraschung plötzlich eine Gähner-Attacke einsetzt, die das gegnerische Pokémon hundemüde macht. Ash hat seine liebe Mühe mit Flavia, die noch weitere Attacken einsetzt und er muss alle Register seines Könnens ziehen, um sich gegen sie zu behaupten. Doch schließlich gelingt es ihm, mit Krebscorps’ Hilfe, das Match zu gewinnen…","　いよいよホウエン地方４つめのバッジをかけたジム戦をむかえたサトシたち。ジムリーダーになったばかりのアスナにとっては、はじめてのジム戦だ。対するサトシはたくさんのジム戦をけいけんしているため、自信まんまん。
　はじめのうちは、ほのおポケモンとたたかうさくせんを考えていたサトシがバトルをリード。しかし、元ジムリーダーのムラ爺（じい）からアドバイスをうけていたアスナも、だんだんおちついてきて、ゆだんしていたサトシにこうげきをはじめ…。"
208651,"Sacha décide de se rendre à Clémenti-Ville pour participer à son prochain combat. En chemin, lui et ses amis tombent sur un groupe de Spinda...","With their adventures in Lavaridge Town over, the gang decide to head back through Mauville City to Petalburg City so Ash can re-challenge Norman to a proper Gym battle. Ash, rememebering Pikachu being beaten up by Vigaroth, is eager to get back to prove himself as a worthy trainer. Before they get too far, however, the gang encounter a group of Spinda, a Pokemon known for having unique markings on their face. Soon they are helping a girl find a Spinda which has a heart-shaped mark on its face, and Team Rocket are looking for the same one to use as bait for Pikachu...
","Auf dem Weg nach Blutenburg City lernen unsere Freunde Claire und ihren Butler Royce kennen. Claire ist ganz außer sich, weil ihr Glückspandir weggelaufen ist. Sie nennt es so, weil sie seit dem ersten Treffen mit diesem Pandir, das ein Herz auf seiner Stirn trägt, nur noch Glück hat. Sie wollte es heute dem eigentlichen Besitzer wieder zurückgeben, da dieser heute von einer langen Reise zurückkehrt. Rocko verliebt sich mal wieder bis über beide Ohren. Unsere Freunde beschließen, Claire bei der Suche nach ihrem Pandir zu helfen. Natürlich ist auch Team Rocket hinter dem Glückspandir her, denn Glück können sie wirklich gebrauchen! Sie fangen Pandir mit Hilfe eines Robo-Pandir. Doch unsere Freunde können es zum Glück wieder befreien. Leider stellt sich heraus, dass der Besitzer von Pandir, Kane, der gerade von seiner Reise zurückgekommen ist, mit Claire verlobt ist. Die beiden wollen heiraten. Rocko nimmt diese Information auf wie ein Mann auf – naja, er versucht es wenigstens…","　トウカジムをつぎのもくてきちにきめ、フエンタウンをしゅっぱつしたサトシたちは、山道で数匹のパッチールと出会う。その中には、ひたいにハートのかたちのもようがついているめずらしいものが。そこへ、そのハートのパッチールをつかまえようと、クレアという女の人があらわれた。だが、ハートのパッチールはしげみの中ににげこんでしまう。
　こまっているようすのクレアからじじょうを聞いてみると、ハートのパッチールはある人からあずかっていて、今日、その人に返さなくてはならないのだという。そこでサトシたちは、クレアといっしょにハートのパッチールをさがしはじめるが…。"
208652,"Sacha, Flora, Max et Pierre poursuivent leurs aventures dans le monde de Hoenn. Ils découvrent alors un univers étonnant et plus menaçant que jamais.","Continuing towards Mauville City, the gang enter Steel Valley, which is home for Steel Pokemon. Before they get too far, however, the gang encounter a Torkoal under attack by Magnemite and a Skarmory. Having wandered into the valley due to it's love of rocky landscapes, the Pokemon that live there have tried to get it to leave. Realizing the pain it's gone through Ash becomes determined to help Torkoal stand up to the other Pokemon. However, unknown to the gang, a Steelix also lives in the valley...
","Unsere Freunde haben sich auf dem Weg nach Malvenfroh City verlaufen und müssen deshalb das Tal des Stahls durchqueren. Dort wird ein Qurtel von Magnetilo und einem Panzaeron angegriffen. Ash und Pikachu helfen Qurtel. Als unsere Freunde und Qurtel wieder angegriffen werden, setzt Maike ihr Flemmli ein. So können sie auch diese Angriffe abwehren. Doch die Angriffe gehen weiter. Denn die Stahl-Pokémon, die in diesem Tal wohnen, sind sehr besitzergreifend. Auch Team Rocket macht mehrmals schmerzhafte Bekanntschaft mit ihnen. Maike fällt unterwegs in eine Felsspalte und kann sich mit letzter Kraft auf halber Höhe an einem Ast festhalten. Ash und seine Freunde retten sie mit Qurtels Hilfe, obwohl sie sich mittlerweile auch gegen ein Magneton wehren müssen. Dann gesellt sich auch noch ein Stahlos hinzu. Doch Stahlos will allein gegen Qurtel kämpfen. Ash ‚coacht‘ Qurtel. Qurtel gewinnt und schließt sich unseren Freunden an.",　トウカシティをめざして旅をつづけるサトシたち。キンセツシティに立ちよるルートをえらぶが、とちゅうで道にまよってしまう。すると、「せきたんポケモン」のコータスが数匹のポケモンたちにこうげきされているのを見かける。コータスをたすけたサトシたちは、このばしょが、なわばりを強くいしきする「はがねポケモン」がすんでいる「ハガネの谷」だと気づいた。キンセツシティへの道をいそぐサトシたちは、たすけたコータスといっしょに谷をぬけることにするが…。
208653,"Sacha et ses amis retournent à Lavandia, où ils découvrent un carnaval organisé par la Team Rocket. Ils laissent leurs Pokémon profiter des festivités et la Team Rocket en profite pour essayer de les capturer.","Having reached Mauville City, the gang decide to visit Wattson at his Gym. However, when neither he or his assistant are there, the group go exploring and come across a carnival run by Team Rocket. Just as Team Rocket succeed in stealing the gang's Pokemon, Wattson appears and uses Electrike to fight Jessie, James and Meowth into blasting off, which causes the Pokemon to evolve into Manectric. With them out of the way, Ash challenges Wattson to a battle against his newly-captured Torkoal...
","Unsere Freunde kommen nach Malvenfroh City. Auf dem dortigen Volksfest toben sie sich zusammen mit ihren Pokémon gründlich aus. Doch dann stiehlt Team Rocket mit einem Spezialnetz all ihre Pokémon. Und dieses Netz scheint unzerstörbar zu sein. Doch mit der Hilfe ihres alten Freundes Walter und dessen Assistenten Watt können sie ihre Pokémon befreien. Durch den Kampf entwickelt sich Walters Frizelbliz zu Voltenso. Zum Spaß, aber auch zu Trainingszwecken, kämpft Maike in der Arena von Malvenfroh City mit ihrem Eneco gegen das Ampharos von Watt. Völlig überraschend gewinnt Maike durch kluges Timing und geschickte Attacken das Match. Als nächstes tritt Ash mit seinem Qurtel gegen Mr. Walter und sein Voltenso an. Es wird ein spannender Kampf, den Mr. Walter gewinnt. Währenddessen hat sich Team Rocket in die Arena geschlichen und muss mit den Tücken der sich dort befindlichen Fallen zurechtkommen. Als sie sich mit drei Raikou Robot anlegen, ist ihr ‚Abflug‘ gesichert. Unsere Freunde beschließen, nach Wiesenflur zu gehen, damit Maike an dem dortigen Pokémon-Wettbewerb teilnehmen kann.",　５つめのバッジを手に入れるためトウカジムをめざすサトシたちは、トウカシティへのとおり道にあるキンセツシティにとうちゃくした。ひさしぶりの大きな町をたのしみながら歩いていると、いろいろなしゅるいのゲームをそろえたゲーム場をはっけん。サトシたちは自分のポケモンをモンスターボールから出し、いっしょにゲームをたのしむが、なんとこのゲーム場はロケット団のワナだった。ロケット団につかまってしまうポケモンたち。それをたすけてくれたのは、かつてキンセツジムでたたかったジムリーダーのテッセンだった。サトシは新しいなかま、コータスの力をためすため、テッセンにバトルをもうしこみ、れんしゅうじあいをすることに…。
208654,"Alors que les enfants sont en route pour Vergazon, ils sont victimes d'un nouveau plan machiavélique de la Team Rocket...","The gang are now headed to Verdanturf Town so May can compete in her next contest, however it isn't long before they fall into one of Team Rocket's classic pitfall traps. While the group are able to send TR blasting off, May's Skitty accidentally breathes in a lot of Ash's Torkoal's smoke and becomes unwell. With no Pokémon Center around, the gang ends up in a Pokémon Aromatherapy Shop, run by a legendary Pokémon Coordinator known for winning many contests with her Skitty, which has since evolved into a Delcatty. While she starts teaching May about contests, Team Rocket plan to steal both Skitty and Delcatty for Giovanni.
","Team Rocket hat unsere Freunde mal wieder in eine seiner berühmten Gruben fallen lassen. Aber unsere Helden können sich retten und zahlen es ihm in einem Kampf heim. Eneco verliert dabei durch Qurtels Rauch seine Stimme. In Foothill Town finden sie eine Pokémon Klinik, in der Dr. Abbey Pokémon mit Hilfe von Massagen und Akupressur heilt. Es stellt sich heraus, dass Dr. Abbey eine berühmte Koordinatorin ist und ein großes Pokémon Festival gewonnen hat. Als ihr Eneco sich in einem Kampf verletzte, hat sie es in der Klinik von Dr. Moss behandeln lassen. Seine natürlichen Heilmethoden inklusive der Akupressur haben sie so beeindruckt, dass sie sich von ihm ausbilden ließ und selbst eine Klinik eröffnet hat. Team Rocket möchte Dr. Abbeys Enecoro und Maikes Eneco stehlen, um die beiden dem Boss als Geschenk zu überreichen. Es kommt zum Kampf, den Team Rocket mal wieder verliert. Ash und seine Freunde verabschieden sich von Dr. Abbey und ziehen weiter nach Wiesenflur.",　ポケモンコンテストがひらかれるシダケタウンをめざして旅をつづけるサトシたち。だが、ロケット団とのバトルでエネコが声を出せなくなったため、とちゅうにあるポケモン診療所（しんりょうじょ）に立ちよることに。ちりょうをうけ、元気をとりもどすエネコ。てあてをしてくれた女性が、ゆうめいなでんせつのコーディネーター・アヤネだと知ったサトシたちは、いろいろと話を聞いてみることにする。しかし、そんな一行にあやしいカゲがしのびより…。
208655,"Sacha, Flora, Max et Pierre poursuivent leurs aventures dans le monde de Hoenn. Ils découvrent alors un univers étonnant et plus menaçant que jamais.","While preparing to enter the Verdanturf Contest with Skitty, May and the others are amazed when they encounter her rival Drew who announces that he is not going to enter as his Roselia is injured after a battle with a Dusclops belonging to a masked trainer. Soon the gang encounter the Masked Co-ordinator and Ash begins a battle with Pikachu Vs. Dusclops, but when a  woman appears looking for her lost son, the Masked Co-ordinator flees, and the gang and drawn into the mystery of his identity...
","Unsere Freunde sind in Wiesenflur angekommen. Dort hält sich ein maskierter Koordinator auf, der sich ‚das Phantom‘ nennt. Niemand kennt seine wahre Identität. Er fordert Ash zu einem Kampf heraus. Ash kommt ziemlich ins Rudern, doch plötzlich bricht das Phantom den Kampf ab, da eine Mrs. Grimm auftaucht. Mrs. Grimm hasst Pokémon, und deshalb hat sie ihrem Sohn Timm verboten, mit ihnen Kontakt zu haben. Mit Hilfe eines Privatdetektivs hat sie herausgefunden, dass überall, wo Timmy auftaucht, auch das Phantom erscheint. Timmy muss also irgendetwas mit dem Phantom zu tun haben. Und damit hat sie Recht. Timmy ist sogar das Phantom! Timmy kann sich gerade noch rechtzeitig vor ihr in Sicherheit bringen. Als Mrs. Grimm schließlich vermutet, dass Timmy das Phantom sein könnte, bittet Mr. Grimm unsere Freunde um Hilfe. Früher war er das Phantom, weil seine Frau nicht wollte, dass er sich mit Pokémon beschäftigt. Als er sah, dass sein Sohn ganz nach ihm kommt und sich für Pokémon interessiert, hat er die Rolle des Phantoms an ihn weitergegeben. Unsere Freunde tüfteln einen Plan aus. Rocko spielt das Phantom, und Mrs. Grimm ist wieder total beruhigt. Timmy freut sich, denn jetzt kann er als ‚das Phantom‘ am Pokémon-Wettbewerb teilnehmen!",　サトシたちはポケモンコンテスト・シダケ大会がひらかれるシダケタウンにとうちゃくした。一行がポケモンセンターに立ちよると、ハルカのライバル、シュウがキズついたロゼリアをあずけていた。仮面（かめん）をつけたナゾのトレーナーにバトルでまけてしまい、今回のコンテストには出られないのだというシュウ。それを聞いたサトシは、つよいシュウをたおしてしまったという仮面のコーディネーター・ファントムに、きょうみをもつのだった。そして、そんなサトシたちにも、ファントムがちかづいてきていて…。
208656,"Sacha, Flora, Max et Pierre poursuivent leurs aventures dans le monde de Hoenn. Ils découvrent alors un univers étonnant et plus menaçant que jamais.","May is preparing for her third contest, and is nervous about entering, despite her Skitty's confidence. Meanwhile Kimimaro (the Phantom Co-ordinator from the previous ep) escapes from his mother and shows up to enter as well with his Dusclops, while Jessie from Team Rocket enters with her Dustox again. When the contest starts, while Kimimaro and Jessie are able to get off good opening appeals, May's Skitty has trouble with it's newly-learnt Blizzard and ends up getting a lower score than the two, making her think she won't progress to the battle rounds. Meanwhile, Kimimaro's mother has discovered where he is and is on her way to the contest to remove her son...
","Timmy kommt im allerletzten Moment zum Pokémon Wettbewerb. Seine Mom wollte ihn mit einem Berg von Hausaufgaben zu Hause festhalten, doch sein Vater gab ihm heimlich die Erlaubnis zu gehen. Beim Wettbewerb hat Maike in ihrer ‚Eröffnungsnummer‘ einige Probleme, die sie dann jedoch wiedergutmachen kann. Sie rückt mit Stefano, Jesslana (=Jessie) und dem Phantom (=Timmy) in die zweite Runde vor. Maike kann auch die zweite Runde für sich entscheiden und tritt im Finale gegen das Phantom an. Mittlerweile sind auch Mr. und Mrs. Grimm in der Arena aufgetaucht und verfolgen den Halbfinalkampf ihres Sohnes. Es stellt sich heraus, dass auch Mrs. Grimm in ihrer Jugend ein Pokémon hatte, dass sie sehr geliebt hat. Doch ihre Eltern hatten ihr eines Tages ihr Pokémon weggenommen, da sie angeblich zu alt dafür geworden sei. Vor diesem Schmerz wollte sie ihren Sohn Timmy schützen. Nur deshalb verbot sie ihm jeglichen Umgang mit Pokémon. Im Endkampf sieht es zunächst düster für Maike aus. Doch mit Hilfe ihrer Zuschuss-Attacke kann sie den Kampf in allerletzter Sekunde für sich entscheiden und gewinnt ihr zweites Band. Als Mrs. Grimm sieht, wie glücklich Timmy mit seinem Zwirrklop ist, lässt sie sich erweichen und erlaubt ihrem Sohn, mit seinem Pokémon zu trainieren und an Wettbewerben teilzunehmen.",　ポケモンコンテストがひらかれるシダケタウンにやってきたサトシたちは、気がよわい少年・キミマロと出会う。彼の母親はポケモンが大きらいで、キミマロに「ポケモン禁止令（きんしれい）」を出していた。だが、じつはキミマロはポケモンのことが大すきなのだということを知ったサトシたちは、彼の父親・タムラマロと力をあわせて、なんとかしてキミマロをポケモンコンテストに出してやろうとかんがえる。また、今回のシダケ大会は、はじめてコンビをくむエネコといっしょに２つめのリボンをめざしているハルカにとっても、だいじなコンテストなのだった。はたして、ハルカとキミマロ、ふたりのコンテストのけっかは？
